{
   "First Name":"Vikas",
   "Middle Name":" ",
   "Last Name":"Choudhary",
   "BirthDate":"17-03-1990",
   "Height":"6",
   "Weight":"90",
   "Billing Street":"plot no 31",
   "Billing City":"Jaipur",
   "Billing State":"Rajasthan",
   "Billing Postal Code":"302012",
   "Billing Country,":"India"
}